{"$schema":"https://json-schema.org/draft/2020-12/schema","title":"Decisions","type":"array","items":{"type":"object","required":["priority","description","possibleOptions","pros","cons","decisionStatus"],"properties":{"priority":{"type":"string"},"description":{"type":"string"},"possibleOptions":{"type":"array","items":{"type":"string"}},"pros":{"type":"array","items":{"type":"string"}},"cons":{"type":"array","items":{"type":"string"}},"decisionStatus":{"type":"string"}}}}
