[
  { "priority": "Alta", "description": "Transporte de Bangkok a Chiang Mai", "possibleOptions": ["Tren nocturno", "Vuelo"], "pros": ["El tren ahorra hotel", "El vuelo ahorra tiempo"], "cons": ["El tren es largo", "El vuelo implica logística de aeropuerto"], "decisionStatus": "Abierta" },
  { "priority": "Alta", "description": "Nivel de buceo en Koh Tao", "possibleOptions": ["Bautismo", "Advanced Open Water", "Solo snorkel"], "pros": ["Actividad memorable", "Mejores puntos de buceo con certificación"], "cons": ["Coste", "Restricciones médicas", "Tiempo"], "decisionStatus": "Abierta" },
  { "priority": "Media", "description": "Full Moon Party", "possibleOptions": ["Ir", "Saltarla", "Noche alternativa"], "pros": ["Icónica", "Experiencia de fiesta"], "cons": ["Logística", "Multitudes", "Coste"], "decisionStatus": "Abierta" },
  { "priority": "Alta", "description": "Objetivo de presupuesto total", "possibleOptions": ["1600 EUR", "1850 EUR", "2200 EUR"], "pros": ["Ayuda a controlar decisiones"], "cons": ["Puede limitar hoteles o actividades"], "decisionStatus": "Abierta" }
]
